ID,Business Name,City,Address,Rating,Reviews,Track,Has Website,Website URL,Owner Name,Verified Email,Booking Button,Signal 1,Signal 2,Signal 3,D1 Sent,D1 Date,D1 Subject,D4 Sent,D4 Date,D8 Sent,D8 Date,Reply,Reply Date,Loom Sent,Loom Date,Paid,Paid Date,Status,Notes
M001,Monaco MedSpa,Miami,2930 NE 2nd Ct,5.0,150,A,Yes,monacomedspa.com,Dr. Jeannette Barrueta,officemanager@monacomedspa.com,No,No Google booking button,Multiple awards — sophisticated operator,Top Morpheus8 provider N America,No,,,,,,,,,,,,PARKED,Too sophisticated — award-winning physician-led. Deprioritised.
M002,LUX MedSpa Brickell,Miami,805 S Miami Ave 9th Floor,5.0,2213,A,Yes,luxmedspabrickell.com,Alan Araujo,info@luxmedspabrickell.com,No,2213 reviews / no Google booking button,Booking via Mangomint not connected to Google,High search traffic with no direct conversion,Yes,2026-05-01,Found something on LUX MedSpa Brickell,No,,No,,No,,No,,CONTACTED,D4 due 2026-05-07
M003,Miami Surgical MedSpa,Miami,815 NW 57th Ave #207,5.0,529,A,Yes,miamisurgicalmedspa.com,Landy Sam,No email found,No,No booking button,,,,No,,,,,,,,,,,,PARKED,No email available — Instagram only
M004,Aviva Medical Spa,Miami,4100 NE 2nd Ave #301,4.7,330,A,Yes,avivamedicalspa.com,Unknown,info@avivamedicalspa.com,No,No Google booking button,Hours discrepancy Google vs website (Mon closed vs open),Only 48 Yelp photos for Design District spa,Yes,2026-05-04,Found something on Aviva Medical Spa,No,,No,,No,,No,,CONTACTED,D4 due 2026-05-09
M005,Solea Brickell Spa,Miami,701 S Miami Ave Suite 311A,4.4,304,A,Yes,soleabrickellspa.com,Unknown,info@soleabrickellspa.com,Yes,Unanswered Yelp complaints — call center + lost reservation,Hours inconsistency across platforms,No Google booking button,Yes,2026-05-04,Found something on Solea Brickell Spa,No,,No,,No,,No,,CONTACTED,D4 due 2026-05-09
M006,Mint Wellness Center FL,Miami,5631 Biscayne Blvd,3.6,223,A,Yes,mintwellness.center,Paula Christiansen,hello@mintwellness.center,No,3.6 rating — 94% of prospects click elsewhere,No Google booking button,Unanswered review complaints,Yes,2026-05-01,Found something on Mint Wellness Center,No,,No,,No,,No,,CONTACTED,paula@ and info@ bounced. D4 due 2026-05-07
M007,Med Aesthetics Miami,Miami,2020 Ponce de Leon Suite 106,4.8,433,A,Yes,medaestheticsmiami.com,Unknown,Unknown,Yes,Has booking — need deeper signal audit,,,,No,,,,,,,,,,,,PENDING AUDIT,Has booking button — need to find signal
M008,Dolce Medical Spa Miami,Miami,2929 SW 3rd Ave suite 610,5.0,1093,A,Yes,dolcemedicalspas.com,Unknown,miami@dolcemedicalspas.com,No,ELIMINATED — multi-state franchise,,,No,,,,,,,,,,,,ELIMINATED,Multi-location franchise
M009,Facial Mania Med Spa,Miami,2711 Biscayne Blvd,4.5,224,A,Yes,facialmania.com,Unknown,Unknown,Yes,4.5 rating — need signal audit,,,,No,,,,,,,,,,,,PENDING AUDIT,Email unknown
M010,DermacareMD Brickell,Miami,1250 S Miami Ave Suite 100,4.6,87,A,Yes,dermacarebrickell.com,Dr. Michelle Barnes,info@dermacarebrickell.com,No,87 reviews in 18 years — severely underrepresented,Only 9 photos on Yelp despite 18 years,No Google booking button,Yes,2026-05-04,Found something on Dermacare Brickell,No,,No,,No,,No,,CONTACTED,D4 due 2026-05-09
M011,Seduction Med Spa,Miami,4950 SW 8th St Suite 200,4.6,65,A,Yes,medspaseduction.com,Unknown,Unknown,No,Address mismatch — wrong business name in tracker,,,,No,,,,,,,,,,,,PARKED,Address belongs to Seduction Med Spa not Svelta — no email found
M012,Miami Beauty Spa,Miami,2603 NW 20th St,4.3,132,A,Yes,Unknown,Unknown,Unknown,Yes,4.3 rating — check unanswered reviews,,,,No,,,,,,,,,,,,PENDING AUDIT,Email unknown
M013,Brickell Cosmetic Center,Miami,2730 SW 3rd Ave Ste 100,4.6,425,A,Yes,brickellcosmetic.com,Julie Pernas,No email — form only,No,No Google booking button + 4.6 rating,,,,No,,,,,,,,,,,,PARKED,No public email available
A001,Austin Med Spa,Austin,1611 W 6th St,4.9,197,A,Yes,austinmedspa.com,Suzette,suzette@austinmedspa.com,No,No booking button,197 reviews with no direct Google conversion path,Strong rating undermined by invisible entry point,Yes,2026-05-01,Found something on Austin Med Spa,No,,No,,No,,No,,CONTACTED,D4 due 2026-05-07
A002,NakedMD Med Spa Austin,Austin,1600 W 38th St #312,4.9,383,A,Yes,nakedmd.com,Unknown,Unknown,Yes,ELIMINATED — 40+ location national chain,,,No,,,,,,,,,,,,ELIMINATED,National chain
A003,Spa Luxe Austin,Austin,2713 Perseverance Dr,4.9,81,A,Yes,spaluxeaustin.com,Unknown,Unknown,Yes,4.9 rating — need signal audit,,,,No,,,,,,,,,,,,PENDING AUDIT,Email unknown
A004,Rejuvenate Austin,Austin,1301 W 5th St #100,4.8,218,A,Yes,rejuvenateaustin.com,Dr. Jessica Wright,hello@rejuvenateaustin.com,No,No booking button,Physician-owned with 218 reviews — direct booking gap,3rd party booking platform not connected to Google,Yes,2026-05-01,Found something on Rejuvenate Austin,No,,No,,No,,No,,CONTACTED,D4 due 2026-05-07
A005,Spa Reveil,Austin,11410 Century Oaks Terrace Suite 140,4.3,481,A,Yes,spareveil.com,Lidya Wati,inquiries@spareveil.com,No,4.3 rating + 481 reviews + no booking button,Triple signal — rating + volume + no conversion path,High search traffic with critical friction,Yes,2026-05-01,Found something on Spa Reveil,No,,No,,No,,No,,CONTACTED,D4 due 2026-05-07
A006,Glo Med Spa Austin,Austin,9801 Anderson Mill Rd #120,4.7,121,A,Yes,glomedicalaustin.com,Unknown,Unknown,Yes,4.7 rating — need signal audit,,,,No,,,,,,,,,,,,PENDING AUDIT,Email unknown
A007,Spa 7,Austin,3401 S Lamar Blvd #3135,4.6,220,A,Yes,spa7austin.com,Unknown,Unknown,Yes,4.6 rating — need signal audit,,,,No,,,,,,,,,,,,PENDING AUDIT,Email unknown
A008,milk + honey 2nd Street,Austin,100A Guadalupe St,4.3,668,A,Yes,milkandhoneyspa.com,Alissa Bayer,Unknown,Yes,ELIMINATED — national chain 40+ locations,,,No,,,,,,,,,,,,ELIMINATED,National chain
A009,Spa Sway Day Domain,Austin,11011 Domain Dr #124,4.6,496,A,Yes,spasway.com,Unknown,Unknown,Yes,4.6 rating — need signal audit,,,,No,,,,,,,,,,,,PENDING AUDIT,Email unknown
A010,Simple Radiance Medspa,Austin,5758 Balcones Dr UNIT 104,4.7,55,A,Yes,simpleradianceaustin.com,Betty Cravens,betty@simpleradiancemedspa.com,No,55 reviews in 8 years — severely underrepresented,Only 12 Yelp reviews + 9 photos — invisible on secondary platforms,No Google booking button,Yes,2026-05-04,Found something on Simple Radiance Medspa,No,,No,,No,,No,,CONTACTED,D4 due 2026-05-09
A011,Novopelle Med Spa,Austin,2210 S 1st St G,4.7,83,A,Yes,novopellemedspa.com,Ritter Vonali,Unknown,No,ELIMINATED — multi-location Austin/Dallas/Houston,,,No,,,,,,,,,,,,ELIMINATED,Multi-location 11-50 employees
A012,Grace Medspa Austin,Austin,3305 Northland Dr #500,4.5,203,A,Yes,gracemedspaaustin.com,Eva Crone,contact@gracemedspaaustin.com,No,No Google booking button,Only 15 Yelp reviews vs 203 Google — uneven platform presence,Facebook shows only 2 reviews — social proof absent,Yes,2026-05-04,Found something on Grace Medspa,No,,No,,No,,No,,CONTACTED,D4 due 2026-05-09
A013,milk + honey Arboretum,Austin,9722 Great Hills Trl #210,4.4,561,A,Yes,milkandhoneyspa.com,Unknown,Unknown,Yes,ELIMINATED — same national chain,,,No,,,,,,,,,,,,ELIMINATED,National chain
S001,Scottsdale Med Spa,Scottsdale,7045 E 3rd Ave,4.9,142,A,Yes,scottsdalemedspa.beauty,Unknown,hello@scottsdalemedspa.beauty,No,No Google booking button,142 reviews with no direct conversion path,No owner name publicly listed,Yes,2026-05-04,Found something on Scottsdale Med Spa,No,,No,,No,,No,,CONTACTED,D4 due 2026-05-09
S002,Elite Medspa Scottsdale,Scottsdale,7001 N Scottsdale Rd #164,4.8,324,A,Yes,elitemedspaaz.com,Doug,info@elitemedspaaz.com,No,No Google booking button,3rd party booking not connected to Google,Troon North location has weak separate Google presence,Yes,2026-05-01,Found something on Elite Medspa,No,,No,,No,,No,,CONTACTED,D4 due 2026-05-07
S003,Caviar Med Spa,Scottsdale,18511 N Scottsdale Rd Suite 102B,4.4,25,A,Yes,caviarmedspa.com,Marlah Kariotoglou,hello@caviarmedspa.com,No,4.4 rating + only 25 reviews + no booking button,Low review volume deprioritised by Google algorithm,No direct conversion path despite good location,Yes,2026-05-01,Found something on Caviar Med Spa,No,,No,,No,,No,,CONTACTED,D4 due 2026-05-07
S004,Amplified Beauty,Scottsdale,10752 N 89th Pl Unit C-231,4.8,327,A,Yes,amplified-beauty.com,Emily Sauls,emilysauls@amplified-beauty.com,No,No Google booking button,Policy page friction before booking calendar,2-4x higher spam risk from info@ address,Yes,2026-05-01,Found something on Amplified Beauty,No,,No,,No,,No,,CONTACTED,D4 due 2026-05-07
S005,Beautify Spa,Scottsdale,8180 N Hayden Rd Ste D-200,4.7,376,A,Yes,beautifyspascottsdale.com,Unknown,Unknown,Yes,4.7 rating — need signal audit,,,,No,,,,,,,,,,,,PENDING AUDIT,Email unknown
S006,Beverlys Med Spa,Scottsdale,5115 N Scottsdale Rd Suite 44,4.6,97,A,Yes,beverlysmedspa.com,Unknown,Unknown,Yes,4.6 rating — need signal audit,,,,No,,,,,,,,,,,,PENDING AUDIT,Email unknown
S007,lavan med spa,Scottsdale,3301 N Miller Rd #115,4.5,203,A,Yes,lavanmedspa.com,Unknown,Unknown,Yes,4.5 rating — need signal audit,,,,No,,,,,,,,,,,,PENDING AUDIT,Email unknown
S008,Pearl Med Spa,Scottsdale,7144 E Stetson Dr Ste C210,4.6,50,A,Yes,pearlmedspa.com,Unknown,az@pearlmedspa.com,No,50 reviews + no booking button + 2-location operation,Board-certified plastic surgeon led — sophisticated,Hours discrepancy website vs Yelp,No,,,,,,,,,,,,PARKED,Multi-location physician-led — lower priority
S009,Ageless Mi MedSpa,Scottsdale,4300 N Miller Rd UNIT 150,4.7,34,A,Yes,agelessmimedspa.com,Dr. Robin Borsa,info@agelessmimedspa.com,No,Website shows New Website Coming Soon — blank holding page,Only 34 Google reviews in 15+ years of operation,No booking button + no functional website,Yes,2026-05-04,Found something on Ageless Mi MedSpa,No,,No,,No,,No,,CONTACTED,D4 due 2026-05-09
